Date,Journal,Author,Prob
"('March', 2018)",Comfort properties of double face knitted fabrics for tennis sportswear,"Suganthi T, Senthilkumar P","[-1.0, 1.0]"
"('March', 2018)",Cyclic bursting loading on needle-punched nonwovens:  Part I – Distention behavior,"Kumar Bipin, Das Apurba, Sharma Atul, Krishnasamy Jagatheesan, Alagirusamy R","[0.9930708661417323, 0.75, -0.8494520547945206, 696969, 696969]"
"('March', 2018)","Dimensional stability of cotton, tencel and tencel/cotton blend plain weft  knitted fabrics","Ramasamy K A, Nalankilli G, Shanmugasundaram O L","[1.0, 696969, 696969]"
"('March', 2018)",A modeling study on lateral compressive behavior of structured needle - punched nonwovens,"Alirezazadeh Azam, Zarrebini Mohammad, Ghane Mohammad","[0.93, 1.0, 1.0]"
"('March', 2018)",Banana pseudostem sap and boric acid— A new green intumescent for making self- extinguishing cotton fabric,"Basak S, Samanta Kartick K, Chattopadhyay S K, Saxena S, Narkar R","[696969, -0.85, 696969, 696969, 696969]"
"('March', 2018)",Prediction of thermo-physiological properties of plated knits by different neural network architectures,"Jhanji Y, Gupta D, Kothari V K","[696969, 0.67, -1.0]"
"('March', 2018)",Effect of residual extensibility of polyester filament yarn on low-stress  mechanical properties of fabric,"Singh Mukesh Kumar, Behera B K","[0.97565, 696969]"
"('March', 2018)",Effect of wrapper filament characteristics and wrap density on physical properties of wrap-spun jute and jute-viscose blended yarns,Chaudhuri Atin,[-0.79]
"('March', 2018)","Morphological, structural and electrical properties of polypyrrole nanocoated bamboo cellulose fibre","Sharma Partha P D, Sarkar D","[-0.5604, 696969]"
"('March', 2018)",Evaluation of liquid moisture transport in textile structures,"Glombikova Viera, Nemcokova Renata, Komarkova Petra, Kus Zdenek","[-1.0, -0.9900000000000001, -0.99, 1.0]"
"('March', 2018)",A novel approach in pigment printing using nano-keratin based binder,"Taleb M Abou, Haggag K, Mostafa Tahia B, ElKheir A Abou, ElSayed H","[0.9709375, 696969, -1.0, 0.97, 1.0]"
"('March', 2018)",Natural dyes from lignocellulosic biomass hydrolysates,Meryemoglu Bahar,[-0.95]
"('March', 2018)",Modal wet processing – A novel approach,"Jadhav Abhishek C, Pingale Navnath, Shukla Sanjeev R","[1.0, 696969, 1.0]"
"('March', 2018)",Swelling and drug release kinetics of composite wound dressing,"Agrawal Anuja, Purwar Roli","[-1.0, 0.63]"
"('March', 2018)",A new approach for color matching of fluorescent dyes in binary mixture,"Bafrooei Fatemeh Khakzar, Khalili Haleh, Safi Mahdi","[-1.0, -1.0, 0.9609090909090909]"
"('March', 2018)",Sodium perborate bleaching of cotton by using tetraacetyl ethylenediamine activator,"Indi Yashovardhan Mallikarjun, Wasif Akhilahmad","[0.813125, 1.0]"
"('March', 2018)",Relationship between morphology and tensile properties of pig hair fibre,"Mohan N H, Nayak L K, Gokuldas P P, Debnath S, Paul M, Ammayappan L, Ramamurty V V, Sarma D K","[1.0, 696969, 696969, 696969, 1.0, 1.0, 696969, 0.67]"
"('March', 2018)",Use of fermented dough extract in the  dyeing of wool fabrics,"Onal Adem, Yilmaz Mustafa, Eser Ferda","[0.99, 1.0, -0.9600000000000001]"
"('June', 2018)","Improvement in dyeing, electro resistivity, and anti-microbial  properties of acrylic fibres",Baseri Somayeh,[-1.0]
"('June', 2018)",Effect of yarn fineness and various knitting parameters on ultraviolet resistance of knitted fabrics,"Banerjee Debamalya, Mal Prithwiraj, Ghosh Anindya, Majumdar Abhijit","[696969, 0.67, 0.8, 1.0]"
"('June', 2018)",Predicting behavior of needled geotextile materials made of recycled  polyester fibres up to yield point,"Trajković Dušan, Stepanović Jovan, Stojiljković Dragan, Đorđić Dragan","[0.97, 0.95, 0.98, 0.98]"
"('June', 2018)",Influence of ring frame process parameters on yarn structure and fabric assistance,"Ishtiaque Saiyed M, Ghosh Dipanjan, Yadav Vijay K","[1.0, 1.0, 0.9800625000000001]"
"('June', 2018)",Finite element simulation of pressing fabric switch at low speed,"Wang Zhangang, Zhao Jun, Zhang Meiling","[0.74, 0.9260869565217391, -0.6307894736842106]"
"('June', 2018)",Dimensional behavior of interlock knitted cotton fabrics,"Roy K, Varshney R, Kothari V K","[0.99, 696969, -1.0]"
"('June', 2018)",Modelling and experimental investigation of mechanical performances of braided polyamide sutures,"Debbabi Faten, Abdessalem Saber Ben","[-1.0, 0.9894710401891252]"
"('June', 2018)",Effect of loading behaviour on compressional property of needle-punched nonwoven fabric,Sengupta Surajit,[1.0]
"('June', 2018)",Study of cyclic bursting loading on needle-punched nonwovens: Part II – Change in air permeability and compression behavior,"Kumar Bipin, Das Apurba, Sharma Atul, Krishnasamy Jagatheesan, Alagirusamy R","[0.9930708661417323, 0.75, -0.8494520547945206, 696969, 696969]"
"('June', 2018)",Development of brightness on handmade woolen carpets,"Malik R K, Goswami K K","[0.99, -1.0]"
"('June', 2018)","Effect of coagulation time, number of coagulation bath and ingredients on properties of continuous graphene oxide fibre","Ucar Nuray, Gokceli Gokcen, Yuksek Ilkay Ozsev, Onen Aysen, Karatepe Nilgun","[-0.98, 696969, 0.67, -1.0, -1.0]"
"('June', 2018)",Laccase-mediated dye-free coloration of wool fabric,"Jia Weini, Wang Qiang, Fan Xuerong, Dong Aixue, Yu Yuanyuan, Wang Ping, Yuan Jiugang","[-0.5932692307692308, 0.7698360655737705, -0.65, 0.8899999999999999, -1.0, -0.6536842105263158, -0.71]"
"('June', 2018)",Use of MS paint for ‘weave and colour pattern’ designing,Panneerselvam R G,[696969]
"('June', 2018)",Predictive algorithm for run-in value of warp knitting based on weave matrix,"Zhang Jisheng, Jiang Gaoming, Cong Honglian, Ma Pibo, Wu Zhiming","[0.54, 0.71, -0.5, 696969, 696969]"
"('June', 2018)",Ultraviolet protection and antibacterial properties of silk fabric dyed with ,"Jiang Huiyu, Khan Asfandyar, Yao Jinbo, Hussain Muhammad Tahir","[0.7293333333333333, 1.0, 0.83, 1.0]"
"('June', 2018)",Effect of backed yarn characteristics on two-thread fleece knitted fabric properties,Fouda Abd Elmonem,[0.9901149425287357]
"('June', 2018)",Impact of biaxial square woven jute fabric reinforcement on mechanical performance of polyester-based composites,"Sezgin Hande, Enis Ipek Yalcin, Berkalp Omer Berk","[-0.9845303867403314, -0.6236969696969696, 0.9315686274509803]"
"('June', 2018)",Automatic pattern separation of jacquard warp-knitted fabric by supervised multi-scale Markov model,"Tong Youcheng, Zhang Yang","[0.68, 0.6064285714285715]"
"('September', 2018)",Quality testing of staple yarn by an instrument with dual sensing and its comparative study with capacitive sensing,"Roy Subhasish, Sengupta Anindita, Sengupta Surajit","[0.99, -0.9, 1.0]"
"('September', 2018)",Prediction of open-hole tensile strength of unidirectional flax yarn reinforced polypropylene composite by analytical and numerical models,"Kannan T Gobi, Pawar S J, Cheng Kuo Bing","[1.0, 696969, -0.5839024390243902]"
"('September', 2018)",Electroneutral quaternization and sulfosuccination of cornstarch for improving the properties of its low-temperature sizing to viscose yarns,"Li Wei, Zhu Zhifeng, Wang Xu, Xu Zhenzhen, Liu Xinhua","[-0.54, 0.67, 0.74, -1.0, 0.75]"
"('September', 2018)",Effect of spinning process parameters on mélange yarn quality by Taguchi experimental design,"Ray Suchibrata, Ghosh Anindya, Banerjee Debamalya","[0.98, 0.8, 696969]"
"('September', 2018)",Evaluation of flexural modulus of carbon 3D orthogonal woven fabric using a trilinear model,"Minapoor Shohreh, Ajeli Saeed, Sheikhzadeh Mohammad","[-1.0, 1.0, 1.0]"
"('September', 2018)",Development and characterisation of biodegradable film from natural polymers,"Ganesan P, Kanmani P","[1.0, -1.0]"
"('September', 2018)",Effects of treatments on the properties of polyester based hemp composite,"Gupta M K, Gond R K, Bharti Ajaya","[0.67, 696969, -1.0]"
"('September', 2018)",Exergy analysis of porous cotton fabric drying process during the  domestic air vented dryer,"Wei Yuhui, Ding Xuemei","[-0.5324509803921569, -0.6305263157894737]"
"('September', 2018)",Effect of MVS process parameters on knitted fabric characteristics,"Dhamija Sudershan, Varshney Rajeev Kumar, Deshdeepak","[1.0, 0.9950837988826816, 696969]"
"('September', 2018)",Enhancement of cotton hydrophobicity through modified styrene admicellar polymerization,"Ulman Khushalini Nitin, Shukla Sanjeev Ramchandra","[1.0, 1.0]"
"('September', 2018)",Antibacterial and self-cleaning properties of cotton fabric treated with TiO,"Derakhshan Seyed Javad, Karimi Loghman, Zohoori Salar, Davodiroknabadi Abolfazl, Lessani Lida","[1.0, -1.0, 1.0, 1.0, -1.0]"
"('September', 2018)","Printing of jute fabric with natural dyes extracted from manjistha, annatto  and ratanjot","Chattopadhyay S N, Pan N C, Khan A","[696969, -0.74, 1.0]"
"('September', 2018)",Chemical auxiliaries free dyeing of cationized cotton with 1:2 metal complex dye,"Hamdaoui Mohamed, Romdhani Zouhaier, Djebbi Ilhem, Harzallah Omar, Harzallah Jamel","[0.99, -0.3333333333333333, -1.0, 1.0, 0.69]"
"('September', 2018)",Effect of TiO,"Ghafarzadeh Reza, ShamsNateri Ali, Shojaie Abdollah Fallah","[1.0, 0.85, 696969]"
"('September', 2018)",Coloration of PLA/modified montmorillonite nanocomposite fibres  with acid and basic dyes,"Nitayaphat Walaikorn, Kampeerapappun Piyaporn","[696969, -1.0]"
"('September', 2018)",Performance of chitosan: jasmine oil microcapsule on jute fabric,"Pan N C, Ammayappan L, Khan A, Chakraborty S","[-0.74, 1.0, 1.0, 696969]"
"('September', 2018)",Low-stress mechanical properties and fabric hand of cotton and polylactic acid fibre blended knitted fabrics,"Guruprasad R, Prasad G Krishna, Prabu G T V, Raj Sheela, Patil P G","[1.0, 0.7884962406015037, 1.0, -0.8674468085106383, 696969]"
"('March', 2017)",Effect of linear density of feed yarn filaments and air-jet texturing process variables on compressional properties of fabrics,"Baldua R K, Rengasamy R S, Kothari V K","[696969, 1.0, -1.0]"
"('March', 2017)",Finite element analysis of mechanical properties of 2.5D angle-interlock woven composites: Part 1— Full-cell model and its validation,"Song Jian, Wen Weidong, Cui Haitao","[0.66475, -0.7001315789473684, -0.2]"
"('March', 2017)",Comfort properties and dyeing behaviour of cotton/milkweed blended  rotor yarn fabrics,"Karthik T, Murugan R, Sakthivel J C","[1.0, 1.0, 1.0]"
"('March', 2017)",Effects of different production processing stages on mechanical and surface characteristics of polylactic acid and PET fibre fabrics,"Hasani Hossein, Avinc Ozan, Khoddami Akbar","[0.9809302325581395, 1.0, 1.0]"
"('March', 2017)",Manufacturing and morphology of poly(ε-caprolactone) based microfibre webs for biomedical applications through airbrush technique,"Bedeloglu Ayse Celik, Bhullar Sukhwinder K, Borazan İsmail, Cin Zeynep Işlek, Demir Ali","[-0.98, 0.6, 1.0, -0.9936703296703296, 0.8512869822485207]"
"('March', 2017)",Modelling of surface roughness based on geometrical parameters of woven fabrics,"Ezazshahabi Nazanin, Tehran Mohammad Amani, Latifi Masoud, Madanipour Khosro","[-1.0, -0.9969418960244648, 1.0, 1.0]"
"('March', 2017)",Regenerated cellulose/multiwalled carbon nanotube composite films with enhanced mechanical properties prepared in NaOH/urea aqueous solution,"Li Qian, Li Qing","[-0.75, -1.0]"
"('March', 2017)",Comfort limit and heat protection properties of single layer cotton/ nylon-Kermel blended fabrics,"Kakvan Ali, Najar Saeed Shaikhzadeh, Psikuta Agnes, Sharifnejad Farshid","[0.85, 1.0, -1.0, 1.0]"
"('March', 2017)","Mechanical, thermal and dynamic mechanical analysis of  jute fibre reinforced epoxy composite","Gupta M K, Srivastava R K","[0.67, 696969]"
"('March', 2017)",A new technique of producing sliver of Estabragh fibres,"Merati Ali Akbar, Moazeni Najmeh","[0.8514627659574467, -1.0]"
"('March', 2017)",Numerical simulation of three-dimensional flow field in three-line rollers and four-line rollers compact spinning systems using finite element method,"Liu Xiaoyan, Liu Xinjin","[-0.76171875, 0.75]"
"('March', 2017)",Finite element modeling of electrospun nanofibre mesh using microstructure architecture analysis,"Gorji M, Jeddi Ali A A, Gharehaghaji A A, Haghpanahi M","[696969, 0.85, 696969, 696969]"
"('March', 2017)",Effect of alkaline treatment on mechanical properties of voile fabric reinforced epoxy composites,Koyuncu Menderes,[1.0]
"('March', 2017)",Effect of moisture and water on thermal protective performance  of multilayered fabric assemblies for firefighters,"Chakraborty Supriyo, Kothari V K","[1.0, -1.0]"
"('March', 2017)",Toughened cyanoethyl starch by blending with poly(methyl acrylate-co-acrylic acid-co-acrylonitrile) latex for warp sizing,"Zhu Zhifeng, Chen Xiaoyu, Wang Miao, Lin Jack","[0.67, -0.5719433198380566, -0.7422857142857143, -0.8379816933638444]"
"('March', 2017)","Effect of lateral crushing on tensile property of bamboo, modal and tencel fibres","Murugan R, Karthik T, Dasardan B S, Subramanian V, Shanmugavadivu K","[1.0, 1.0, 696969, 1.0, -1.0]"
"('March', 2017)",Effect of chemical treatments on physico-chemical properties of fibres from banana fruit and bunch stems,"Yılmaz Nazire Deniz, Sulak Mine, Yılmaz Kenan, Khan G M Arifuzzaman","[-0.6273291925465838, -0.9799999999999999, 0.9933505154639174, 1.0]"
"('June', 2017)",Effect of nanoclay loading on zeta potential of polyester nanocomposite fibre,"Teli MD, Kale Ravindra D, Bhatt L","[696969, 0.9878481012658227, 696969]"
"('June', 2017)",Recipe optimisation for sugarcane bagasse fibre reinforced soy protein biocomposite,"Singh Vikas Kumar, Mukhopadhyay Samrat, Das Dipayan","[0.9771361502347418, 1.0, 0.7777777777777778]"
"('June', 2017)",Ammonia sensing properties of different polyaniline-based composite nanofibres,"Pang Zengyuan, Nie Qingxin, Yang Jie, Huang Fenglin, Xu Yang, Wei Qufu","[-0.7, -1.0, -0.6595081967213116, -0.59, 0.65, -0.54]"
"('June', 2017)",Effects of godet wheel position on compact siro-spun core yarn characteristics,"Zhang Xiaojuan, Xu Bojun, Xie Chunping, Liu Xinjin, Su Xuzhong, Zhu Yukun","[-0.5474193548387097, 696969, 0.67, 0.75, 696969, 0.67]"
"('June', 2017)",Development of reinforced interlining materials to regulate elastic properties,"Kornilova Nadezhda, Koksharov Sergey, Arbuzova Anna, Shukla Armaiti, Mundkur Suman","[-0.92, 0.99, -1.0, 696969, 0.69]"
"('June', 2017)",Studies on nature of anisotropy of tensile properties and fibre orientation in  cross-laid needle-punched nonwoven fabrics,"Ray Sadhan Chandra, Ghosh Papai","[0.9264864864864866, 1.0]"
"('June', 2017)",Nonlinear Maxwell modelling of inverse relaxation in yarns and fabrics,"Mandhyan P K, Nachane R P, Banerjee S, Pawar B R, Koli H S","[696969, 696969, 696969, 696969, -1.0]"
"('June', 2017)",Investigation of tensile resilience properties of stretch denim fabrics,"Ancutiene Kristina, Koldinska Marie, Havelka Antonin","[-1.0, -0.9899999999999999, 1.0]"
"('June', 2017)",Moisture management and wicking properties of polyester- cotton plated knits,"Jhanji Yamini, Gupta Deepti, Kothari V K","[-0.95, -0.9829310344827585, -1.0]"
"('June', 2017)",Determination of antioxidant capacity of capsule loaded textiles,"Türkoğlu Gizem Ceylan, Sariişik Ayşe Merih, Erkan Gökhan, Kayalar Hüsniye, Kontart Oya, Öztuna Selda","[-0.9551351351351353, -0.8911658031088083, 0.9961645569620253, -0.93, -0.98, -0.97]"
"('June', 2017)",Effect of weave parameters on air resistance of woven fabrics produced from compact doubled yarn,Vimal J Thanikai,[0.9700000000000001]
"('June', 2017)",Single bath enzymatic scouring and bleaching process for preparation of  absorbent cotton,"Raja A S M, Arputharaj A, Saxena Sujata, Patil P G","[0.79, 696969, -1.0, 696969]"
"('June', 2017)",Production of POSS nanoparticle containing polypropylene fibres dyeable with acid and basic dyes,Davulcu Asim,[1.0]
"('June', 2017)",Self -extinguishable cellulosic textile from ,"Basak S, Samanta Kartick K, Saxena S, Chattopadhyay S K, Parmar M S","[696969, -0.85, 696969, 696969, 696969]"
"('June', 2017)",Properties of cellulosic fabrics treated by water-repellent emulsions,"Mohamed Amina L, Hassabo Ahmed G, Nada Ahmed A, AbouZeid Nabil Y","[-0.99, 0.9900000000000001, -0.8133183856502242, 0.99]"
"('June', 2017)",Effect of stacking sequence on mechanical strength of bamboo/Kevlar K29 inter-ply laminated hybrid composite,"Singh Thingujam Jackson, Samanta Sutanu","[0.9616751269035533, -0.8206349206349206]"
"('June', 2017)",Activated bleaching with sodium perborate and potassium persulphate,"Mallikarjun  Indi Yashovardhan, Wasif Akhilahmad, Patel Aftab Abdulajij","[0.813125, 1.0, 0.9464285714285714]"
"('June', 2017)",Kaolin shear thickening fluid reinforced UHMWPE composites for protective clothing,"Fernando E A S K, Dharmasena I G, Niles S N","[1.0, 696969, 0.67]"
"('September', 2017)","Effect of fibre, yarn and fabric variables on heat and moisture  transport properties of plated knit","Jhanji Y, Gupta D, Kothari V K","[696969, 0.67, -1.0]"
"('September', 2017)",A novel biodegradable micro-nano tubular knitted structure of PGA braided  yarns and PCL nanofibres applicable as esophagus prosthesis,"Yekrang Javad, Semnani Dariush, Seyghlani Amin Zadbagher, Razavi Shahnaz","[1.0, 1.0, 0.91, -1.0]"
"('September', 2017)",Electromagnetic shielding effectiveness of woven fabrics having metal coated  zari wrapped yarns,"Veer Jai, Kothari V K","[0.7068181818181818, -1.0]"
"('September', 2017)",Improved filtration properties of hydroentangled PTFE/PPS  fabric filters caused by fibrillation,"Nan Zhang, Xiangyu Jin, Chen Huang, Qinfei Ke","[-0.44932291666666674, 0.56, -0.5736860068259385, 696969]"
"('September', 2017)",Development of herbal drug loaded antimicrobial silk suture,"Sudha D, Dhurai Bhaarathi, Ponthangam T","[-1.0, 696969, 696969]"
"('September', 2017)","Mechanical, thermal and morphological studies of microfibrillated jute/PLA biocomposites","Khan G M Arifuzzaman, AbdullahAlMamun M, Haque M Ahsanul, Rahman Md Shafiqur, Shaikh Hamid, Anis Arfat, AlZahrani Saeed M, Alam M Shamsul","[1.0, 696969, 1.0, 1.0, 0.9772527472527471, 0.73, 1.0, 0.9339999999999999]"
"('September', 2017)",Sound absorption properties of polyurethane-based warp-knitted  spacer fabric composites,"Chen Si, Chen Hongxia, Gao Xiaoping, Long Hairu","[0.57, 0.57, -0.57, 0.86]"
"('September', 2017)",Impact and flexural properties of hybrid jute/HTPET fibre reinforced epoxy composites,"Ahmadi M S, Dastan T","[696969, 1.0]"
"('September', 2017)",Preparation of UV-resistant PET fibres by direct melt  spinning with on-line addition,"Zhaohui Jiang, Zengge Guo, Zhao Jia, Jing Wang, Congcong Pu, Changfa Xiao, Jian Jin","[0.71, 0.88, -0.6014285714285714, -0.282, 696969, -0.74, 0.5911666666666666]"
"('September', 2017)",Thermal comfort properties of single jersey fabrics made from recycled polyester and cotton blended yarns,"Vadicherla Thilak, Saravanan D","[1.0, 0.9600000000000001]"
"('September', 2017)",Consumed sewing thread behaviour based on lockstitch and chainstitch,"Boubaker Jaouachi, Sana Aouine, Faouzi Khedher","[696969, -0.85, 1.0]"
"('September', 2017)",A comparison of filtration performance of triangular and  circular cross-section fibre,"Zhang Xiaolin, Jin Xiangyu","[-0.5474193548387097, 0.56]"
"('September', 2017)",Effect of disperse red dye on spectral red-shift of green-emitting luminous fibre,"Chen Zhi, Li Jing, Ge Mingqiao","[0.585698113207547, -0.72, 696969]"
"('September', 2017)",Hydrophilization of poly (lactic acid) fibre and its combination with  dyeing and UV protection finishing,"Huang JianYi, Guan Jinping, Tang RenCheng, Liu KaiQiang","[-0.59, 0.8, -0.54, 0.75]"
"('September', 2017)",Sensory evaluation of different pashmina shawls,"Shakyawar D B, Kadam V V, Kumar Ajay, Mathuriya S R, Kumar Pramod","[696969, 696969, 0.99, 696969, 0.9954639175257732]"
"('September', 2017)",New theoretical modeling for predicting yarn angle on OE yarn influenced by fibre movement on torus coordinate based on  classical mechanics approach,"Putra Valentinus Galih Vidia, Rosyid M Farchani, Maruto Guntur","[-0.9535714285714285, 696969, 1.0]"
"('September', 2017)",Anisotropic mechanical behavior of thermally bonded nonwoven fabric,"Gao Xiaoping, Wu Wei, Wang Liping","[-0.57, -0.54, -0.7447272727272728]"
"('December', 2017)",Analytical model to study a new design concept for providing comfort  in hot arid climate,"Bal Kausik, Hes Lubos, Bajzik Vladimir","[0.901, -0.8636363636363636, 1.0]"
"('December', 2017)",Properties of viscose air-jet spun plied yarns,"Eldeeb Moaz, Moučková Eva, Ursíny Petr","[1.0, -1.0, 1.0]"
"('December', 2017)",Effect of dielectric barrier discharge parameters on properties of mulberry silk fibre,"Navik Rahul, Dalvi Ajit, Sanas Payal, Karande Shivraj, Cai Yingjie","[1.0, 0.95, -1.0, 696969, -0.76]"
"('December', 2017)",Compressional behavior of Persian hand knotted wool carpets using response surface methodology,"Gupta Shravan Kumar, Majumdar Abhijit, Goswami Kamal Kanti","[0.9807216494845362, 1.0, -0.9634859154929577]"
"('December', 2017)",Novel device for evaluating sweat evaporation characteristics of woven and knitted fabrics,"Raja D, Senthilkumar M, Mani K","[0.79, 1.0, 0.73]"
"('December', 2017)",Impact of abrasion on mass loss and appearance of injected slub yarn fabrics,"Mukhopadhyay Arunangshu, Midha Vinay Kumar, Ray Nemai Chandra","[696969, 0.9971147540983607, 0.9264864864864866]"
"('December', 2017)",Prediction of Poisson’s ratio of worsted woven fabrics considering fabric extension in various directions,"Ezazshahabi Nazanin, Varkiyani Seyyed Mohammad Hosseini, Saharkhiz Siamak","[-1.0, 1.0, 1.0]"
"('December', 2017)",Low-stress mechanical properties of weft knitted fabrics produced from regular and compact cotton spun yarns,"Farid Afrose Fathima, Roshanara, Subramaniam V","[-1.0, 696969, 1.0]"
"('December', 2017)",Geometrical modeling for bi-axial weft knitted fabrics based on rib structure,"Abghary Mohammad Javad, Hasani Hossein, Nedoushan Reza Jafari","[1.0, 0.9809302325581395, -1.0]"
"('December', 2017)",Improved performance of woven substrates in needle-punched  nonwoven filters using needles with modified cross-section,"Nan Zhang, Qinfei Ke, Chen Huang, Xiangyu Jin","[-0.44932291666666674, 696969, -0.5736860068259385, 0.56]"
"('December', 2017)",Examination of liquid management of sub-compression wadding  for chronic venous disorders,"Kumar B, Das A, Alagirusamy R, Singh J","[0.9900000000000001, 0.75, 696969, 0.79]"
"('December', 2017)",Development of breathable and liquid/microbes barrier woven  surgical gowns for hospital usage,"Krishnasamy Jagatheesan, Senthilkumar T, Neelakandan R","[696969, 1.0, 696969]"
"('December', 2017)",Antimicrobial treatment of silk with silver nanoparticles using acrylic binder,"Nadiger Vinay G, Shukla Sanjeev R","[1.0, 1.0]"
"('December', 2017)",Use of amorphous TiO,"Goel Abhishek, Osta Shashank, Mishra Anu, Butola Bhupendra Singh","[1.0, 1.0, -0.9205263157894737, 0.8753125]"
"('December', 2017)",Preparation and characterisation of Nylon/PEG/PAN  composite membrane for liquid filtration,"Nallathambi Gobi, Abinaya M, Ragavee S, Sivaranjani R, Arunkarthick S, Nisha S, Devi B","[1.0, -1.0, 696969, -1.0, 696969, -0.99, -0.89]"
"('December', 2017)",Moisture management characteristics of knitted casein fabric,Rathinamoorthy R,[696969]
"('December', 2017)",Synthesis of core-shell fluorine-silicon containing polyacrylate latexes for water and oil repellent finishing of cotton fabric,"Fan Zenglu, Li Qing, Cai Xinbin, Xiao Qianqian, Zhang Long","[-0.65, -1.0, -0.76, -0.7425242718446602, 0.6857142857142858]"
"('December', 2017)",Dynamic analysis of a warp-knitting machine with pneumatic drive for producing  3D knitted fabrics,"Michalak Andrzej, Kuchar Maciej, Mikołajczyk Zbigniew","[0.98, 1.0, 1.0]"
"('March', 2016)",Colour effect on fibre diameter measurement with OFDA 2000,"Li Q, Brady P R, Hurren C J, Wang X G","[696969, 0.97, 696969, 0.74]"
"('March', 2016)",Pilling evaluation of patterned fabrics based on a gradient field method,"Techniková Lenka, Tunák Maroš, Janáček Jiří","[-1.0, 1.0, 1.0]"
"('March', 2016)",Impact of high temperature and pressure on sericin scouring of muga silk cocoons,"Choudhury Manasee, Devi Dipali","[696969, -0.8994285714285715]"
"('March', 2016)",Stabilised blending delay time in blowroom multimixer,Majumdar Abhijit,[1.0]
"('March', 2016)",Dope dyeing of polyacrylonitrile filaments with Ratanjot,"Purwar Roli, Sahoo Priyadarshan, Jain Mehak, Bothra Urvashi, Yadav Priya, Juneja Jigyasu, Srivastava Chandra Mohan","[0.63, 1.0, -0.9655172413793104, -1.0, -0.9800881057268722, 1.0, 0.7390756302521009]"
"('March', 2016)",Laser eco-printing technology for silk fabric patterns,"Chen Jinxiang, Meng Chuang, Xie Juan, Pan Le, Zhou Dong, Chen JunNan","[0.57, 0.6408, 0.989790712884238, -0.74, 0.8802941176470588, 0.57]"
"('March', 2016)","<span en-us="""" lang=""EN-US"" mso-bidi-font-family:="""" new="""" roman="""" style=""font-size:11.0pt;mso-bidi-font-size: 10.0pt;font-family:"" times="""">Optimization of sizing parameters with taguchi method</span>","Sabır Emel Ceyhun, Sarpkaya Çiğdem","[-0.5460869565217391, -1.0]"
"('March', 2016)",Predicting hydrophobicity of silica sol-gel coated dyed cotton fabric by artificial neural network and regression,"Malik Samander Ali, Saleemi Sidra, Mengal Naveed","[0.8546451240623196, -1.0, 0.99]"
"('March', 2016)",Filtration properties of staple fibre thermo-bonded nonwoven fabrics,"Kalaivani D, Karthick S Arun, Gobi N","[696969, 1.0, 1.0]"
